{
  "$schema": "https://json-schema.org/draft/2020-12/schema",
  "$id": "https://wirespec.dev/schemas/wirespec-annotation-sidecar-v0.2.schema.json",
  "title": "WireSpec Annotation Sidecar v0.2",
  "type": "object",
  "additionalProperties": false,
  "required": ["schemaVersion", "documentId", "threads"],
  "properties": {
    "schemaVersion": {
      "const": "0.2.0"
    },
    "documentId": {
      "type": "string"
    },
    "source": {
      "type": "object",
      "additionalProperties": false,
      "properties": {
        "wireFile": { "type": "string" },
        "astFile": { "type": "string" },
        "component": { "type": "string" }
      }
    },
    "threads": {
      "type": "array",
      "items": { "$ref": "#/$defs/thread" }
    }
  },
  "$defs": {
    "thread": {
      "type": "object",
      "additionalProperties": false,
      "required": [
        "id",
        "status",
        "severity",
        "motivation",
        "category",
        "target",
        "messages",
        "createdAt",
        "updatedAt"
      ],
      "properties": {
        "id": {
          "type": "string",
          "pattern": "^ann-[A-Za-z0-9][A-Za-z0-9-]*$"
        },
        "title": { "type": "string" },
        "status": {
          "enum": ["open", "accepted", "in-progress", "resolved", "wontfix"]
        },
        "severity": {
          "enum": ["must", "should", "could", "question"]
        },
        "motivation": {
          "enum": ["note", "question", "change-request", "issue", "approval", "blocking"]
        },
        "category": { "type": "string" },
        "taxonomy": {
          "type": "array",
          "items": { "type": "string" }
        },
        "orphaned": { "type": "boolean" },
        "target": { "$ref": "#/$defs/target" },
        "messages": {
          "type": "array",
          "minItems": 1,
          "items": { "$ref": "#/$defs/message" }
        },
        "suggestedOps": {
          "type": "array",
          "items": { "$ref": "#/$defs/op" }
        },
        "createdAt": { "type": "string", "format": "date-time" },
        "updatedAt": { "type": "string", "format": "date-time" },
        "resolutionNote": { "type": "string" }
      }
    },
    "target": {
      "type": "object",
      "additionalProperties": false,
      "required": ["targetId", "screenId", "scope", "anchors"],
      "properties": {
        "targetId": { "type": "string" },
        "screenId": { "type": "string" },
        "scope": {
          "enum": ["screen", "section", "element", "prose", "acceptance", "region"]
        },
        "wireId": { "type": "string" },
        "variantKey": { "type": "string" },
        "anchors": {
          "type": "array",
          "items": { "$ref": "#/$defs/anchor" }
        }
      }
    },
    "anchor": {
      "oneOf": [
        { "$ref": "#/$defs/nodeIdAnchor" },
        { "$ref": "#/$defs/selectorAnchor" },
        { "$ref": "#/$defs/sourceSpanAnchor" },
        { "$ref": "#/$defs/textQuoteAnchor" },
        { "$ref": "#/$defs/renderRegionAnchor" }
      ]
    },
    "nodeIdAnchor": {
      "type": "object",
      "additionalProperties": false,
      "required": ["type", "value"],
      "properties": {
        "type": { "const": "node-id" },
        "value": { "type": "string" }
      }
    },
    "selectorAnchor": {
      "type": "object",
      "additionalProperties": false,
      "required": ["type", "value"],
      "properties": {
        "type": { "const": "selector" },
        "value": { "type": "string" }
      }
    },
    "sourceSpanAnchor": {
      "type": "object",
      "additionalProperties": false,
      "required": ["type", "file", "lineStart", "lineEnd"],
      "properties": {
        "type": { "const": "source-span" },
        "file": { "type": "string" },
        "lineStart": { "type": "integer", "minimum": 1 },
        "lineEnd": { "type": "integer", "minimum": 1 },
        "columnStart": { "type": "integer", "minimum": 1 },
        "columnEnd": { "type": "integer", "minimum": 1 }
      }
    },
    "textQuoteAnchor": {
      "type": "object",
      "additionalProperties": false,
      "required": ["type", "exact"],
      "properties": {
        "type": { "const": "text-quote" },
        "exact": { "type": "string" },
        "prefix": { "type": "string" },
        "suffix": { "type": "string" }
      }
    },
    "renderRegionAnchor": {
      "type": "object",
      "additionalProperties": false,
      "required": ["type", "x", "y", "width", "height"],
      "properties": {
        "type": { "const": "render-region" },
        "x": { "type": "number" },
        "y": { "type": "number" },
        "width": { "type": "number", "minimum": 0 },
        "height": { "type": "number", "minimum": 0 }
      }
    },
    "message": {
      "type": "object",
      "additionalProperties": false,
      "required": ["id", "author", "body", "createdAt"],
      "properties": {
        "id": {
          "type": "string",
          "pattern": "^msg-[A-Za-z0-9][A-Za-z0-9-]*$"
        },
        "author": { "type": "string" },
        "authorRole": {
          "enum": ["human", "agent", "system"]
        },
        "body": { "type": "string" },
        "createdAt": { "type": "string", "format": "date-time" }
      }
    },
    "op": {
      "oneOf": [
        { "$ref": "#/$defs/patchOp" },
        { "$ref": "#/$defs/showHideRemoveOp" },
        { "$ref": "#/$defs/insertOp" }
      ]
    },
    "patchOp": {
      "type": "object",
      "additionalProperties": false,
      "required": ["op", "target", "props"],
      "properties": {
        "op": { "const": "patch" },
        "target": { "type": "string" },
        "props": {
          "type": "object",
          "additionalProperties": true
        }
      }
    },
    "showHideRemoveOp": {
      "type": "object",
      "additionalProperties": false,
      "required": ["op", "target"],
      "properties": {
        "op": { "enum": ["show", "hide", "remove"] },
        "target": { "type": "string" }
      }
    },
    "insertOp": {
      "type": "object",
      "additionalProperties": false,
      "required": ["op", "position", "ref", "node"],
      "properties": {
        "op": { "const": "insert" },
        "position": {
          "enum": ["before", "after", "inside-start", "inside-end"]
        },
        "ref": { "type": "string" },
        "node": {
          "type": "object",
          "additionalProperties": true
        }
      }
    }
  }
}
